{
  "schema": "openCinema-pluginMarket-v1",
  "name": "OpenCinema Plugin Market",
  "generatedAt": "2026-10-31T12:41:11.558Z",
  "plugins": [
    {
      "id": "gaussianSplatNode",
      "name": "Gaussian Splat",
      "displayName": {
        "en": "Gaussian Splat",
        "zh-CN": "Gaussian Splat"
      },
      "version": "1.0.0",
      "description": {
        "en": "View 3D Gaussian Splatting scans (PLY, SPLAT, KSPLAT, SPZ) on the canvas, set a camera, and render stills and turntable videos as references for downstream nodes.",
        "zh-CN": "在画布中查看 3D Gaussian Splatting 扫描（PLY / SPLAT / KSPLAT / SPZ），设定机位，渲染静帧与环绕视频，作为下游节点的参考。"
      },
      "author": "OpenCinema",
      "license": "MIT",
      "homepage": "https://github.com/junjamrk/OpenCinema/blob/main/packages/nodes/gaussianSplatNode/readme.md",
      "repository": "https://github.com/junjamrk/OpenCinema/tree/main/packages/nodes/gaussianSplatNode",
      "tags": [
        "3d",
        "gaussian-splatting",
        "viewer",
        "reference",
        "render"
      ],
      "scope": "node",
      "requires": {
        "workspaceFiles": 1,
        "workspaceReadRange": 1,
        "nodeHistory": 1,
        "ffmpeg": 1,
        "worker": 1
      },
      "url": "plugins/gaussianSplatNode/1.0.0/install.json",
      "sha256": "108dde64e16da2ff36d49a6d2edc8cd22fca6f7084d66533868637b41a50697a",
      "size": 1082826,
      "publishedAt": "2026-10-31T00:00:00Z",
      "minHost": "0.4.0",
      "agentGuide": true
    }
  ]
}
